char,jyutping
無風不起浪,mou4 fung1 bat1 hei2 long6
煎佢皮,zin1 keoi5 pei4
煞唔切掣,saat3 m4 cit3 zai3
照住佢,ziu3 zyu6 keoi5
照噉睇,ziu3 gam2 tai2
照噉睇嚟,ziu3 gam2 tai2 lai4
照噉講,ziu3 gam2 gong2
照我所知,ziu3 ngo5 so2 zi1
照葫蘆畫瓢,ziu3 wu4 lou4 waak6 piu4
煮乜鬼飯,zyu2 mat1 gwai2 faan6
煮佢一鍋,zyu2 keoi5 jat1 wo1
煮到嚟就食,zyu2 dou3 lai4 zau6 sik6
煮到埋嚟先食,zyu2 dou2 maai4 lai4 sin1 sik6
煮到埋嚟就食,zyu2 dou3 maai4 lai4 zau6 sik6
煮嘢畀你,zyu2 je5 bei2 nei5
煮我飯,zyu2 ngo5 faan6
煮死佢,zyu2 sei2 keoi5
煮畀我食,zyu2 bei2 ngo5 sik6
煲冇米粥,bou1 mou5 mai5 zuk1
煲冇米粥，水汪汪,bou1 mou5 mai5 zuk1 seoi2 wong1 wong1
熟人買爛鑊,suk6 jan4 maai5 laan6 wok6
熟唔熟,suk6 m4 suk6
熱烈地彈琴熱烈地唱,jit6 lit6 dei6 taan4 kam4 jit6 lit6 dei6 coeng3
熱鍋上的螞蟻,jit6 wo1 soeng6 dik1 maa5 ngai5
燈光咁黑,dang1 gwong1 gam3 hak1
燈着咗啦,dang1 zoek6 zo2 la1
燒你數簿,siu1 nei5 sou3 bou2
燒到我嗰疊,siu1 dou3 ngo5 go2 daap6
燒喇叭,siu1 laa3 baa1
燒嘢食,siu1 je5 sik6
燒燶咗,siu1 nung1 zo2
燕雀安知鴻鵠之志,jin3 zoek3 on1 zi1 hung4 huk6 zi1 zi3
燥熱嘢,cou3 jit6 je5
爆你大鑊,baau3 nei5 daai6 wok6
爆佢大鍋,baau3 keoi5 daai6 wo1
爆鑊大嘢,baau3 wok6 daai6 je5
爆鑊杰嘢,baau3 wok6 git6 je5
爛泥扶不上牆,laan6 nai4 fu4 bat1 soeng5 coeng4
爛泥扶唔上壁,laan6 nai4 fu4 m4 soeng5 bek3
爛泥扶唔上柄,laan6 nai4 fu4 m4 soeng5 bek3
爛船仲有三斤釘,laan6 syun4 zung6 jau5 saam1 gan1 deng1
爛船都仲有三斤釘,laan6 syun4 dou1 zung3 jau5 saam1 gan1 deng1
爛船都有三斤釘,laan6 syun4 dou1 jau5 saam1 gan1 deng1
爛鬼嘢,laan6 gwai2 je5
爬到咁高,paa4 dou3 gam3 gou1
爭一啲,zang1 jat1 di1
爭一日之長短,zaang1 jat1 jat6 zi1 coeng4 dyun2
爭乜鬼,zaang1 mat1 gwai2
爭住佢,zaang1 zyu6 keoi5
爭佢兩蚊,zaang1 keoi5 loeng5 man1
爭唔落,zaang1 m4 lok6
爭啲唔掂,caang1 di1 m4 dim6
爭啲唔記得咗,zaang1 di1 m4 gei3 dak1 zo2
爭實佢哋,zang1 sat6 keoi5 dei6
爭緊啲嘢,zang1 gan2 di1 je5
爲乜事,wai6 mat1 si6
爲乜事幹,wai4 mat1 si6 gon3
爲乜嘢,wai6 mat1 je5
爲人民服務,wai6 jan4 man4 fuk6 mou6
爲他人作嫁衣裳,wai6 taa1 jan4 zok3 gaa3 ji1 soeng4
爲你鍾情,wai6 nei5 zung1 cing4
爲唔過,wai4 m4 gwo3
爲善不欲人知,wai4 sin6 bat1 juk6 jan4 zi1
爲富不仁，爲仁不富,wai4 fu3 bat1 jan4 wai4 jan4 bat1 fu3
爽死你啦,song2 sei2 nei5 laa1
爾虞我詐,ji5 jyu4 ngo5 zaa3
牀下底吹喇叭,cong4 haa6 dai2 ceoi1 laa3 baa1
牀下底破柴,cong4 haa6 dai2 po3 caai4
牀下底破柴：撞板,cong4 haa6 dai2 po3 caai4 zong6 baan2
牀前明月光,cong4 cin4 ming4 jyut6 gwong1
牀板夾春袋,cong4 baan2 gep6 ceon1 doi2
牀板跳上蓆,cong4 baan2 tiu3 soeng5 zek6
牀頭打交牀尾和,cong4 tau4 daa2 gaau1 cong4 mei3 wo4
牙痛噉聲,ngaa4 tung3 gam2 seng1
牙痛慘過大病,ngaa4 tung3 caam2 gwo3 daai6 beng6
牙齒當金使,ngaa4 ci2 dong3 gam1 sai2
牛唔飲水唔㩒得牛頭低,ngau4 m4 jam2 seoi2 m4 gam6 dak1 ngau4 tau4 dai1
牛唔飲水唔撳得牛頭低,ngau4 m4 jam2 seoi2 m4 gam6 dak1 ngau4 tau4 dai1
牛唔飲水點撳得牛頭低,ngau4 m4 jam2 seoi2 dim2 gam6 dak1 ngau4 tau4 dai1
牛噉眼,ngau4 gam2 ngaan5
牛嚼牡丹唔知花定草,ngau4 ziu6 maau5 daan1 m4 zi1 faa1 ding6 cou2
牛皮燈籠：點極唔明,ngau4 pei4 dang1 lung4 dim2 gik6 m4 meng4
牛頭不對馬嘴,ngau4 tau4 bat1 deoi3 maa5 zeoi2
牛頭唔搭馬嘴,ngau4 tau4 m4 daap3 maa5 zeoi2
牛頭角順嫂,ngau4 tau4 gok3 seon6 sou2
牡丹雖好，終須綠葉扶持,maau5 daan1 seoi1 hou2 zung1 seoi1 luk6 jip6 fu4 ci4
物以稀爲貴,mat6 ji5 hei1 wai4 gwai3
物以罕爲貴,mat6 ji5 hon2 wai4 gwai3
物以類聚，人以羣分,mat6 ji5 leoi6 zeoi6 jan4 ji5 kwan4 fan1
物似主人形,mat6 ci5 zyu2 jan4 jing4
物我兩忘,mat6 ngo5 loeng5 mong4
物輕情義重,mat6 hing1 cing4 ji6 zung6
物離鄉貴，人離鄉賤,mat6 lei4 hoeng1 gwai3 jan4 lei4 hoeng1 zin6
牽一髮而動全身,hin1 jat1 faat3 ji4 dung6 cyun4 san1
牽着鼻子走,hin1 zoek6 bei6 zi2 zau2
犀利啦,sai1 lei6 la1
犧牲小我，完成大我,hei1 sang1 siu2 ngo5 jyun4 sing4 daai6 ngo5
犯法嘢,faan6 faat3 je5
狂轟炸我,kong4 gwang1 zaa3 ngo5
狐狸先生幾多點,wu4 lei2 sin1 saang1 gei2 do1 dim2
狗口長不出象牙,gau2 hau2 zoeng2 bat1 ceot1 zoeng6 ngaa4
狗咬呂洞賓,gau2 ngaau5 leoi5 dung6 ban1
狗咬呂洞賓，不識好人心,gau2 ngaau5 leoi5 dung6 ban1 bat1 sik1 hou2 jan4 sam1
狗嘴吐不出象牙,gau2 zeoi2 tou3 bat1 ceot1 zoeng6 ngaa4
狗嘴裏吐不出象牙,gau2 zeoi2 leoi5 tou3 bat1 ceot1 zoeng6 ngaa4
狗改不了喫屎,gau2 goi2 bat1 liu5 hek3 si2
狗眼看人低,gau2 ngaan5 hon3 jan4 dai1
狗竇咁亂,gau2 dau3 gam3 lyun6
狗都唔吼,gou2 dou1 m4 hau1
狗都唔睺,gau2 dou1 m4 hau1
狡兔死走狗烹,gaau2 tou3 sei2 zau2 gau2 paang1
狹路相逢勇者勝,haap3 lou6 soeng1 fung4 jung5 ze2 sing3
狼過華秀隻狗,long4 gwo3 waa4 sau3 zek3 gau2
猛咁呻,maang5 gam3 san1
猛咁嗌,maang5 gam3 aai3
猛咁食,maang5 gam3 sik6
猛噉嗍氣,maang5 gam2 sok3 hei3
猛虎不及地頭蟲,maang5 fu2 bat1 kap6 dei6 tau4 cung4
獨在異鄉爲異客,duk6 zoi6 ji6 hoeng1 wai4 ji6 haak3
獨木不成林,duk6 muk6 bat1 sing4 lam4
獻醜不如藏拙,hin3 cau2 bat1 jyu4 cong4 zyut3
獻醜嘅啫,hin3 cau2 ge3 ze1
玉不琢，不成器,juk6 bat1 doek3 bat1 sing4 hei3
王婆賣瓜，自賣自誇,wong4 po4 maai6 gwaa1 zi6 maai6 zi6 kwaa1
玩佢唔起,waan2 keoi5 m4 hei2
玩到興烚烚,waan2 dou3 hing3 hap6 hap6
玩到興高采烈,waan2 dou3 hing3 gou1 coi2 lit6
玩唔玩,waan2 m4 waan2
玩唔起,waan2 m3 hei2
玩嘢啊,waan2 je5 aa2
玩晒啦,waan2 saai3 laa1
玩真嘅,waan2 zan1 ge3
珍珠都冇咁真,zan1 zyu1 dou1 mou5 gam3 zan1
班仆街冚家剷,baan1 puk1 gaai1 ham6 gaa1 caan2
班禪喇嘛,baan1 sim4 laa1 maa4
理你咁多,lei5 nei5 gam3 do1
理你邊個,lei5 nei5 bin1 go3
理唔掂佢,lei5 m4 dim6 keoi5
理得佢,lei5 dak1 keoi5
理得佢死,lei5 dak1 keoi5 sei2
理性與感性,lei5 sing3 jyu5 gam2 sing3
瓜無滾圓，人無十全,gwaa1 mou4 gwan2 jyun4 jan4 mou4 sap6 cyun4
瓜田不納履，李下不整冠,gwaa1 tin4 bat1 naap6 lei5 lei5 haa6 bat1 zing2 gun1
瓜田李下之嫌,gwaa1 tin4 lei5 haa6 zi1 jim4
瓜褦藤，藤褦瓜,gwaa1 nang3 tang4 tang4 nang3 gwaa1
瓜賴藤藤賴瓜,gwaa1 laai6 tang4 tang4 laai6 gwaa1
瓦檐獅子，叻到舋,ngaa5 jam4 si1 zi2 lek1 dou3 man3
瓦簷獅子，叻到舋,ngaa5 jam4 si1 zi2 lek1 dou3 man3
生不帶來，死不帶去,sang1 bat1 daai3 loi4 sei2 bat1 daai3 heoi3
生人唔生膽,saang1 jan4 m4 saang1 daam2
生人霸死地,saang1 jan4 baa3 sei2 dei6
生仔冇屎忽,saang1 zai2 mou5 si2 fat1
生仔冇屎窟,saang1 zai2 mou5 si2 fat1
生仔唔知仔心肝,saang1 zai2 m4 zi1 zai2 sam1 gon1
生仔姑娘醉酒佬,saang1 zai2 gu1 noeng4 zeoi3 zau2 lou2
生命不息，戰鬥不止,sang1 ming6 bat1 sik1 zin3 dau3 bat1 zi2
生命在於運動,sang1 ming6 zoi6 jyu1 wan6 dung6
生咗仔,saang1 zo2 zai2
生嚿叉燒好過生你,saang1 gau6 caa1 siu1 hou2 gwo3 saang1 nei5
生於憂患，死於安樂,sang1 jyu1 jau1 waan6 sei2 jyu1 on1 lok6
生於斯長於斯,sang1 jyu1 si1 zoeng2 jyu1 si1
生滋貓入眼,saang1 zi1 maau1 jap6 ngaan5
生產關係,sang1 caan2 gwaan1 hai6
生米煮成熟飯,saang1 mai5 zyu2 sing4 suk6 faan6
生累街坊，死累朋友,saang1 leoi6 gaai1 fong1 sei2 leoi6 pang4 jau5
生蝦咁跳,saang1 haa1 gam2 tiu3
生蝦噉跳,saang1 haa1 daam6 tiu3
生蝦噉跳,saang1 haa1 gam2 tiu3
生螆貓入眼,saang1 zi1 maau1 jap6 ngaan3
生骨大頭菜,saan1 gwat1 daai6 tau4 coi3
用唔用到,jung6 m4 jung6 dou2
用屎忽諗嘢,jung6 si2 fat1 nam2 je5
用慣咗,jung6 gwaan3 zo2
用戶到網絡接口,jung6 wu6 dou3 mong5 lok6 zip3 hau2
甩咗線,lat1 zo2 sin3
甩唔倒身,lat1 m4 dou2 san1
甩身唔到,lat1 san1 m4 dou2
田雞過河，各有各𨅝,tin4 gai1 gwo3 ho4 gok3 jau5 gok3 jaang3
由佢啦,jau2 keoi5 laa1
由佢喇,jau2 keoi5 laa3
由佢湊,jau4 keoi5 cau3
由儉入奢易,jau4 gim6 jap6 ce1 ji6
由儉入奢易由奢入儉難,jau4 gim6 jap6 ce1 ji6 jau4 ce1 jap6 gim6 naan4
由得你,jau2 dak1 nei5
由得佢啦,jau2 dak1 keoi5 laa1
由得佢喇,jau2 dak1 keoi5 laa3
男人不壞，女人不愛,naam4 jan4 bat1 waai6 neoi5 jan4 bat1 oi3
男人去飲湯,naam4 jan4 heoi3 jam2 tong1
男人膝下有黃金,naam4 jan4 sat1 haa6 jau5 wong4 gam1
男兒有淚不輕彈,naam4 ji4 jau5 leoi6 bat1 hing1 taan4
男女授受不親,naam4 neoi5 sau6 sau6 bat1 can1
男子漢大丈夫,naam4 zi2 hon3 daai6 zoeng6 fu1
男怕入錯行，女怕嫁錯郎,naam4 paa3 jap6 co3 hong4 neoi5 paa3 gaa3 co3 long4
畀人屌到撻皮,bei2 jan4 diu2 dou3 taat3 pei4
畀人棍咗,bei2 jan4 gwan3 zo2
畀人賣豬仔,bei2 jan4 maai6 zyu1 zai2
畀人食咗隻豬,bei2 jan4 sik6 zo2 zek3 zyu1
畀你做咩,bei2 nei5 zou6 me1
畀你吹脹,bei2 nei5 ceoi1 zoeng3
畀你啦,bei2 nei5 la1
畀你睇下,bei2 nei5 tai2 haa5
畀你蝦,bei2 nei5 haa1
畀你食,bei2 nei5 sik6
畀佢入嚟,bei2 keoi5 jap6 lai4
畀個冬瓜你做膽,bei2 go3 dung1 gwaa1 nei5 zou6 daam2
畀個天你做膽,bei2 go3 tin1 nei5 zou6 daam2
畀個官你做,bei2 go3 gun1 nei5 zou6
畀到你嘅,bei2 dou2 nei5 ge3
畀啲錢佢,bei2 di1 cin2 keoi5
畀埋我,bei2 maai4 ngo5
畀定唔畀,bei2 ding6 m4 bei2
畀我入,bei2 ngo5 jap6
畀我入去,bei2 ngo5 jap6 heoi3
畀我咯,bei2 ngo5 lok3
畀我啊,bei2 ngo5 aa2
畀我喫,bei2 ngo5 hek3
畀晒你,bei2 saai3 nei5
畀晒你啦,bei2 saai3 nei5 la1
畀煲佢哋,bei2 bou1 keoi5 dei6
畀着我,bei2 zoek6 ngo5
畀西瓜皮你踩,bei2 sai1 gwaa1 pei4 nei5 caai2
畀返你,bei2 faan1 nei5
畀都唔,bei2 dou1 m4
畀錫壞咗,bei2 sek3 waai6 zo2
畀電話我,bei2 din6 waa2 ngo5
畀面色佢睇,bei2 min6 sik1 keoi5 tai2
畀高帽佢戴,bei2 gou1 mou2 keoi5 daai3
畀鬧到一戙都冇,bei2 naau6 dou3 jat1 dung6 dou1 mou5
畀鬧到一隻屐,bei2 naau6 dou3 jat1 zek3 kek6
畀鬧到一面屁,bei2 naau6 dou3 jat1 min6 pei3
畀鬧到死死下,bei2 naau6 dou3 sei2 sei2 haa2
留低你,lau4 dai1 nei5
留响屋企湊仔,lau4 hoeng2 uk1 kei2 cau3 zai2
留得青山在，不怕沒柴燒,lau4 dak1 cing1 saan1 zoi6 bat1 paa3 mut6 caai4 siu1
留得青山在，哪怕冇柴燒,lau4 dak1 cing1 saan1 zoi6 naa5 paa3 mou5 caai4 siu1
留得青山在，哪怕無柴燒,lau4 dak1 cing1 saan1 zoi6 naa5 paa3 mou4 caai4 siu1
留意咗,lau4 ji3 zo2
留意唔到,lau4 ji3 m4 dou2
留返拜山先講,lau4 faan1 baai3 saan1 sin1 gong2
番鬼佬月餅,faan1 gwai2 lou2 jyut6 beng2
番鬼佬涼茶,faan1 gwai2 lou2 loeng4 caa4
番鬼佬荔枝,faan1 gwai2 lou2 lai6 zi1
畫公仔唔使畫出腸,waak6 gung1 zai2 m3 sai2 waak6 ceot1 coeng2
畫公仔唔駛畫出腸,waak6 gung1 zai2 m3 sai2 waak6 ceot1 coeng2
畫公仔畫出腸,waak6 gung1 zai2 waak6 ceot1 coeng2
畫唔到,waak6 m4 dou2
畫虎不成反類犬,waak6 fu2 bat1 sing4 faan2 leoi6 hyun2
當住佢講,dong1 zyu6 keoi5 gong2
當你神噉拜,dong3 nei5 san4 gam2 baai3
當佢冇來,dong3 keoi5 mou5 loi4
當佢冇到,dong3 keoi5 mou5 dou3
當佢冇嚟,dong3 keoi5 mou5 lai4
當冇到,dong3 mou5 dou3
當冇嘢,dong3 mou5 je5
當家方知柴米貴,dong1 gaa1 fong1 zi1 caai4 mai5 gwai3
當局者迷，旁觀者清,dong1 guk6 ze2 mai4 pong4 gun1 ze2 cing1
當我流,dong3 ngo5 lau4
當然關啦,dong1 jin2 gwaan1 laa1
當畀面我,dong1 bei2 min2 ngo5
當神噉拜,dong3 san4 gam2 baai3
當自己屋企得㗎喇,dong3 zi6 gei2 uk1 kei2 dak1 gaa3 laa3
當自己屋企得喇,dong3 zi6 gei2 uk1 kei2 dak1 laa3
畸卡咁笑,ki1 kaa1 gam3 siu3
疊起佢,dip6 hei2 keoi5
疍家雞見水,daan6 gaa1 gai1 gin3 seoi2
疑心生暗鬼,ji4 sam1 saang1 am3 gwai2
疾風知勁草,zat6 fung1 zi1 ging6 cou2
疾風知勁草，烈火見真金,zat6 fung1 zi1 ging6 cou2 lit6 fo2 gin3 zan1 gam1
病來如山倒，病去如抽絲,beng6 loi4 jyu4 saan1 dou2 beng6 heoi3 jyu4 cau1 si1
病到五顏六色,beng6 dou3 ng5 ngaan4 luk6 sik1
病到懵咗,beng6 dou3 mung2 zo2
病向淺中醫,beng6 hoeng3 cin2 zung1 ji1
病從口入，禍從口出,beng6 cung4 hau2 jap6 wo6 cung4 hau2 ceot1
病急亂投醫,beng6 gap1 lyun6 tau4 ji1
痛到死死下,tung3 dou3 sei2 sei2 haa2
痛死我啦,tung3 sei2 ngo5 la1
痾唔唔,o1 m1 m1
痾尿唔出賴風猛,o1 niu6 m4 ceot1 laai6 fung1 maang5
痾屎唔出賴地硬,o1 si2 m4 ceot1 laai6 dei6 ngaang6
瘡埋口喇,cong1 maai4 hau2 laa3
瘦到得棚骨,sau3 dou3 dak1 paang4 gwat1
瘦到成條柴噉,sau3 dou3 sing4 tiu4 caai4 gam2
瘦田冇人耕耕開有人爭,sau3 tin4 mou5 jan4 gaang1 gaang1 hoi1 jau5 jan4 zaang1
瘦田冇人耕，耕開有人爭,sau3 tin4 mou5 jan4 gaang1 gaang1 hoi1 jau5 jan4 zaang1
瘦蜢蜢噉,sau3 maang2 maang2 gam2
瘦骨如柴煲碌竹,sau3 gwat1 jyu4 caai4 bou1 luk1 zuk1
癐到乜噉,gui6 dou2 mat1 gam2
癡咗線,ci1 zo2 sin3
癡癡呆呆，坐埋一檯,ci1 ci1 ngoi4 ngoi4 co5 maai4 jat1 toi4
癩蛤蟆想食天鵝肉,laai3 haa1 mou1 soeng2 sik6 tin1 ngo4 juk6
登陸咗,dang1 luk6 zo2
發你脾氣,faat3 nei5 pei4 hei3
發到豬頭噉,faat3 dou3 zyu1 tau4 gam2
發咗一個夢,faat3 zo2 jat1 go3 mung6
發咗癲,faat3 zo2 din1
發啲嘢,faat3 di1 je5
發夢冇咁早,faat3 mung6 mou5 gam3 zou2
發夢都未見過,faat3 mung6 dou1 mei6 gin3 gwo3
發夢都諗唔到,faat3 mung6 dou1 lam2 m4 dou3
發我脾氣,faat3 ngo5 pei4 hei3
發生咩事,faat3 sang1 me1 si6
發畀你,faat3 bei2 nei5
發畀我,faat3 bei2 ngo5
發給我,faat3 kap1 ngo5
發誓當食生菜,faat3 sai6 dong3 sik6 saang1 coi3
發錯咗,faat3 co3 zo2
白頭人送黑頭人,baak6 tau4 jan4 sung3 haak1 tau4 jan4
白髮人送黑髮人,baak6 faat3 jan4 sung3 hak1 faat3 jan4
百分之一百,baak3 fan6 zi1 jat1 baak3
百善孝爲先,baak3 sin6 haau3 wai4 sin1
百尺竿頭，更進一步,baak3 cek3 gon1 tau4 gang3 zeon3 jat1 bou6
百思不得其解,baak3 si1 bat1 dak1 kei4 gaai2
百聞不如一見,baak3 man4 bat1 jyu4 jat1 gin3
百花齊放，百家爭鳴,baak3 faa1 cai4 fong3 baak3 gaa1 zang1 ming4
百貨應百客,baak3 fo3 jing3 baak3 haak3
百足咁多爪,baak3 zuk1 gam3 do1 zaau2
的咁多,dik1 gam3 doe1
皇冠上的明珠,wong4 gun1 soeng6 dik1 ming4 zyu1
皇天不負有心人,wong4 tin1 bat1 fu6 jau5 sam1 jan4
皇天不負苦心人,wong4 tin1 bat1 fu6 fu2 sam1 jan4
皇帝不急急死太監,wong4 dai3 bat1 gap1 gap1 sei2 taai3 gaam3
皇帝唔急太監急,wong4 dai3 m4 gap1 taai3 gaam3 gap1
皇帝女唔憂嫁,wong4 dai3 neoi2 m4 jau1 gaa3
皮幾嘢,pei4 gei2 je5
盡人事聽天命,zeon6 jan4 si6 ting1 tin1 ming6
盡在不言中,zeon6 zoi6 bat1 jin4 zung1
盡地主之誼,zeon6 dei6 zyu2 zi1 ji4
監人食死貓,gaam1 jan4 sik6 sei2 maau1
監粗嚟啊,gaam3 cou1 lai4 aa3
盲字都唔識多隻,maang4 zi6 dou1 m4 sik1 do1 zek3
盲拳打死老師父,maang4 kyun4 daa2 sei2 lou5 si1 fu2
直頭係,zik6 tau4 hai6
相喺邊度,soeng2 hai2 bin1 dou6
相嗌唔好口,soeng1 aai3 m4 hou2 hau2
相當於或大於,soeng1 dong1 jyu1 waak6 daai6 jyu1
相處咗,soeng1 cyu3 zo2
相見好同住難,soeng1 gin3 hou2 tung4 zyu6 naan4
相見好，同住難,soeng1 gin3 hou2 tung4 zyu6 naan4
相請不如偶遇,soeng1 cing2 bat1 jyu4 ngau5 jyu6
盼星星盼月亮,paan3 sing1 sing1 paan3 jyut6 loeng6
省到一面屁,saang2 dou3 jat1 min6 pei3
省到立立令,saang2 dou3 laap3 laap3 ling3
眉毛鬍子一把抓,mei4 mou4 wu4 zi2 jat1 baa2 zaa1
看住我,hon1 zyu6 ngo5
看唔到,hon3 m4 dou3
看牛噉看,hon1 ngau4 gam2 hon1
真人不露相,zan1 jan4 bat1 lou6 soeng3
真人不露相，露相非真人,zan1 jan4 bat1 lou6 soeng3 lou6 soeng3 fei1 zan1 jan4
真係㗎,zan1 hai6 gaa3
真係偉大,zan1 hai6 wai5 daai6
真係冇修,zan1 hai6 mou5 sau1
真係冇耳性,zan1 hai6 mou5 ji5 sing3
真係冇陰功,zan1 hai6 mou5 jam1 gung1
真係冇面,zan1 hai6 mou5 min2
真係叻,zan1 hai6 lek1
真係叻噃,zan1 hai6 lak6 bo3
真係吖,zan1 hai6 aa1
真係吹脹,zan1 hai6 ceoi1 zoeng3
真係咧氣,zan1 hai6 le4 hei3
真係唔似樣,zan1 hai6 m4 ci5 joeng6
真係唔化,zan1 hai6 m4 faa3
真係唔掂,zan1 hai6 m4 dim6
真係啊,zan1 hai6 aa2
真係啱,zan1 hai6 ngaam1
真係嗍氣,zan1 hai6 sok3 hei3
真係夠煩,zan1 hai6 gau3 faan4
真係好攰,zan1 hai6 hou2 gui6
真係巴閉,zan1 hai6 baa1 bai3
真係廢嘅,zan1 hai6 fai3 ge3
真係慘嘞,zan1 hai6 caam2 laak3
真係掯,zan1 hai6 kang3
真係曳,zan1 hai6 jai6
真係正呀,zan1 hai6 zeng3 aa3
真係激氣,zan1 hai6 gik1 hei3
真係火滾,zan1 hai6 fo2 gwan2
真係爽,zan1 hai6 song2
真係甩鬚,zan1 hai6 lat1 sou1
真係矛盾,zan1 hai6 maau4 teon5
真係老土,zan1 hai6 lou5 tou2
真係衰嘅啫,zan1 hai6 seoi1 ge3 ze1
真係調皮,zan1 hai6 tiu3 pei4
真係識講,zan1 hai6 sik1 gong2
真係難得,zan1 hai6 naan4 dak1
真係靈,zan1 hai6 ling4
真冇修,zan1 mou5 sau1
真冇癮,zan1 mou5 jan5
真唔似樣,zan1 m4 ci5 joeng2
真唔好彩,zan1 m4 hou2 coi2
真唔真㗎,zan1 m4 zan1 gaa4
真定假㗎,zan1 ding6 gaa2 gaa3
真定假㗎,zan1 ding6 gaa3 gaa3
真定假啊,zan1 ding6 gaa2 aa3
真金不怕火煉,zan1 gam1 bat1 paa3 fo2 lin6
真金不怕紅爐火,zan1 gam1 bat1 paa3 gung1 lou4 fo2
眼不見心不煩,ngaan5 bat1 gin3 sam1 bat1 faan4
眼不見爲乾淨,ngaan5 bat1 gin3 wai4 gon1 zeng6
眼不見爲淨,ngaan5 bat1 gin3 wai4 zing6
眼不見，心不念,ngaan5 bat1 gin3 sam1 bat1 nim6
眼不見，心不煩,ngaan5 bat1 gin3 sam1 bat1 faan4
眼中釘，肉中刺,ngaan5 zung1 deng1 juk6 zung1 ci3
眼光光噉,ngaan5 gwong1 gwong1 gam2
眼大睇過龍,ngaan5 daai6 tai2 gwo3 lung4
眼定定噉望,ngaan5 ding6 ding6 gam2 mong6
眼尾都唔望,ngaan5 mei5 dou1 m4 mong6
眼尾都唔睄,ngaan5 mei5 dou1 m4 saau4
眼屎乾淨盲,ngaan5 si2 gon1 zeng6 maang4
眼睛生響頭頂,ngaan5 zing1 saang1 hoeng2 tau4 deng2
眼瞠唔開,ngaan5 caang1 m4 hoi1
眼裏容不得沙子,ngaan5 leoi5 jung4 bat1 dak1 saa1 zi2
眼見爲實，耳聽爲虛,ngaan5 gin3 wai4 sat6 ji5 ting1 wai4 heoi1
眼觀六路耳聽八方,ngaan5 gun1 luk6 lou6 ji5 ting1 baat3 fong1
眼觀四處，耳聽八方,ngaan5 gun1 sei3 cyu3 ji5 ting3 baat3 fong1
眼觀四面，耳聽八方,ngaan5 gun1 sei3 min6 ji5 ting3 baat3 fong1
眼觀鼻鼻觀心,ngaan5 gun1 bei6 bei6 gun1 sam1
眼𥋇唔開,ngaan5 caang3 m4 hoi1
着三不着兩,zoek6 saam1 bat1 zoek6 loeng5
着咩衫,zoek3 me1 saam1
着唔落,zoek6 m4 lok6
着埋一條褲,zoek3 maai4 jat1 tiu4 fu3
着起龍袍唔似太子,zoek3 hei2 lung4 pou4 m4 ci5 taai3 zi2
着龍袍唔似太子,zoek6 lung4 pou4 m4 ci5 taai3 zi2
睄佢一眼,saau4 keoi5 jat1 ngaan5
睄佢幾眼,saau3 keoi5 gei2 ngaan5
睇下佢,tai2 haa5 keoi5
睇下嘢,tai2 haa5 je5
睇下戲啦,tai2 haa5 hei3 laa1
睇乜鬼,tai2 mat1 gwai2
睇低你,tai2 dai1 nei5
睇住佢頭,tai2 zyu6 keoi5 tau2
睇你個樣,tai2 nei5 go3 joeng2
睇你吖,tai2 nei5 aa1
睇你唔起,tai2 nei5 m4 hei2
睇你想點,tai2 nei5 soeng2 dim2
睇你頭,tai2 nei5 tau2
睇你點算,tai2 nei5 dim2 syun3
睇佢個樣,tai2 keoi5 go3 joeng2
睇佢唔起,tai2 keoi5 m4 hei2
睇佢嘅面,tai2 keoi5 ge3 min6
睇佢就嬲,tai2 keoi5 zau6 nau1
睇佢幾好,tai2 keoi5 gei2 hou2
睇佢眼冤,tai2 keoi5 ngaan5 jyun1
睇咁多,tai2 gam3 do1
睇咁耐,tai2 gam3 noi6
睇咗啦,tai2 zo2 la1
睇咩嘢,tai2 me1 je5
睇唔上,tai2 m4 soeng5
睇唔上眼,tai2 m4 soeng5 ngaan5
睇唔入眼,tai2 m4 jap6 ngaan5
睇唔出,tai2 m4 ceot1
睇唔出嚟,tai2 m4 ceot1 lai4
睇唔切,tai2 m4 cit3
睇唔完,tai2 m4 jyun4
睇唔真,tai2 m4 zan1
睇唔睇到,tai2 m4 tai2 dou2
睇唔起,tai2 m4 hei2
睇唔過眼,tai2 m4 gwo3 ngaan5
睇唔開,tai2 m4 hoi1
睇情況啦,tai2 cing4 fong3 la1
睇我唔起,tai2 ngo5 m4 hei2
睇相佬呃你十年八年,tai2 soeng3 lou2 aak1 nei5 sap6 nin4 baat3 nin4
睇相佬呃你十年八年,tai2 soeng3 lou2 ngaak1 nei5 sap6 nin4 baat3 nin4
睇真啲,tai2 zan1 di1
睇都唔睇,tai2 dou1 m4 tai2
睇開啲,tai2 hoi1 di1
睇餸食飯睇燭喃嘸,tai2 sung3 sik6 faan6 tai2 zuk1 naam4 mo4
睇餸食飯，睇燭喃嘸,tai2 sung3 sik6 faan6 tai2 zuk1 naam4 mo4
睜隻眼閉隻眼,zang1 zek3 ngaan5 bai3 zek3 ngaan5
睡着啦,seoi6 zoek6 laa1
睬你都憨,coi2 nei5 dou1 ham1
睬你都生臭狐,coi2 nei5 dou1 saang1 cau3 wu4
睬佢都,coi2 keoi5 dou1
睬佢都傻,coi2 keoi5 dou1 so4
睬佢都戇,coi2 keoi5 dou1 ngong6
睬唔睬,coi2 m4 coi2
睬返佢,coi2 faan1 keoi5
睺住佢,hau1 zyu6 keoi5
睺唔實,hau1 m4 sat6
睺實佢,hau1 sat6 keoi5
瞄咗一眼,miu4 zo2 jat1 ngaan5
瞄咗下,miu4 zo2 haa5
瞓唔夠,fan3 m4 gau3
瞓唔安食唔落,fan3 m4 on1 sik6 m4 lok6
瞓唔着,fan3 m4 zyu6
瞓唔着覺,fan3 m4 zoek6 gaau3
瞓喺度都贏,fan3 hai2 dou6 dou1 jeng4
瞓得唔淰,fan3 dak1 m4 nam6
瞓晏咗,fan3 aan3 zo2
瞓晒身落去,fan3 saai3 san1 lok6 heoi3
瞓覺啦你,fan3 gaau3 laa1 nei5
瞓覺喇,fan3 gaau3 laa3
瞓覺喇你,fan3 gaau3 laa4 nei5
瞞住我,mun4 zyu6 ngo5
瞠唔開眼,caang1 m4 hoi1 ngaan5
知人口面不知心,zi1 jan4 hau2 min6 bat1 zi1 sam1
知人知面不知心,zi1 jan4 zi1 min6 bat1 zi1 sam1
知人者智，自知者明,zi1 jan4 ze2 zi3 zi6 zi1 ze2 ming4
知其一不知其二,zi1 kei4 jat1 bat1 zi1 kei4 ji6
知其一，不知其二,zi1 kei4 jat1 bat1 zi1 kei4 ji6
知其不可爲而爲之,zi1 kei4 bat1 ho2 wai4 ji4 wai4 zi1
知其然，不知其所以然,zi1 kei4 jin4 bat1 zi1 kei4 so2 ji5 jin4
知唔少,zi1 m4 siu2
知唔知個死字點寫,zi1 m4 zi1 go3 sei2 zi6 dim2 se2
知唔知個醜字點寫,zi1 m4 zi1 go3 cau2 zi6 dim2 se2
知唔知埞呀,zi1 m4 zi1 deng6 aa3
知啲唔知啲,zi1 di1 m4 zi1 di1
知子莫若父,zi1 zi2 mok6 joek6 fu6
知就好啦,zi1 zau6 hou2 laa1
知己知彼，百戰不殆,zi1 gei2 zi1 bei2 baak3 zin3 bat1 toi5
知彼知己，百戰不殆,zi1 bei2 zi1 gei2 baak3 zin3 bat1 toi5
知彼知己，百戰百勝,zi1 bei2 zi1 gei2 baak3 zin3 baak3 sing3
知恥近乎勇,zi1 ci2 gan6 fu4 jung5
知識越多越反動,zi3 sik1 jyut6 do1 jyut6 faan2 dung6
知錯啦,zi1 co3 la1
知頭唔知尾,zi1 tau4 m4 zi1 mei5
短啲頭髮,dyun2 di1 tau4 faat3
矮仔多計，矮女多仔,ai2 zai2 do1 gai2 ai2 neoi2 do1 zai2
矮啲腯,ai2 di1 dat1
石地塘鐵掃把,sek6 dei6 tong4 tit3 sou3 baa2
石地塘鐵掃把硬打硬,sek6 dei6 tong4 tit1 sou3 baa2 ngaang6 daa2 ngaang6
砌十鑊八鑊,cai3 sap6 wok6 baat3 wok6
破屋又遭連夜雨,po3 uk1 jau6 zou1 lin4 je6 jyu5
硬係唔信,ngaang2 hai6 m4 seon3
硬係噉,ngaang2 hai6 gam2
硬咗舦,ngaang6 zo2 taai5
硬唔硬,ngaang6 m4 ngaang6
碗碟碰埋都有聲,wun2 dip6 pung3 maai4 dou1 jau5 seng1
磨破嘴皮子,mo4 po3 zeoi2 pei4 zi2
神不知鬼不覺,san4 bat1 zi1 gwai2 bat1 gok3
神主牌都會喐,san4 zyu2 paai2 dou1 wui5 juk1
神又係你鬼又係你,san4 jau6 hai6 nei5 gwai2 jau6 hai6 nei5
神又係佢鬼又係佢,san4 jau6 hai6 keoi5 gwai2 jau6 hai6 keoi5
神又係佢，鬼又係佢,san4 jau6 hai6 keoi5 gwai2 jau6 hai6 keoi5
神檯貓屎神憎鬼厭,san4 toi4 maau1 si2 san4 zang1 gwai2 jim3
神聖不可侵犯,san4 sing3 bat1 ho2 cam1 faan6
神舟號飛船,san4 zau1 hou6 fei1 syun4
神龍見首不見尾,san4 lung4 gin3 sau2 bat1 gin3 mei5
禀神都冇句真,ban2 san4 dou1 mou5 geoi3 zan1
禍不及妻兒,wo6 bat1 kap6 cai1 ji4
禮多人不怪,lai5 do1 jan4 bat1 gwaai3
禮輕人意重,lai5 hing1 jan4 ji3 cung5
禮輕人意重，千里送鵝毛,lai5 hing1 jan4 ji3 zung6 cin1 lei5 sung3 ngo4 mou4
禮輕情意重,lai5 hing1 cing4 ji3 zung6
禾熟噉頭,wo4 suk6 gam2 tau2
禾稈冚珍珠,wo4 gon2 kam2 zan1 zyu1
秀才不出門，全知天下事,sau3 coi4 bat1 ceot1 mun4 cyun4 zi1 tin1 haa6 si6
秀才不出門，能知天下事,sau3 coi2 bat1 ceot1 mun4 nang4 zi1 tin1 haa6 si6
秀才遇着兵,sau3 coi2 jyu6 zoek6 bing1
私人醒嘅,si1 jan4 sing2 ge3
秋蟬跌落地,cau1 sim4 dit3 lok6 dei6
秋風掃落葉,cau1 fung1 sou3 lok6 jip6
秋風起，三蛇肥,cau1 fung1 hei2 saam1 se4 fei4
秋風起，食臘味,cau1 fung1 hei2 sik6 laap6 mei2
稀裏嘩啦,hei1 leoi5 waa1 laa1
程尋磨鉸叉燒包，老鼠唔食豆沙包,cing1 cam1 mo4 gaau3 caa1 siu1 baau1 lou5 syu2 m4 sik6 dau6 saa1 baau1
稟神噉聲,ban2 san4 gam2 seng1
稟神都冇句真,ban2 san4 dou1 mou5 geoi3 zan1
種瓜得瓜，種豆得豆,zung3 gwaa1 dak1 gwaa1 zung3 dau2 dak1 dau2
稱唔上,cing1 m4 soeng5
積埋啲錢,zik1 maai4 di1 cin4
穩坐釣魚臺,wan2 zo6 diu3 jyu4 toi4
究竟咩事,gau3 ging2 me1 si6
空口說白話,hung1 hau2 syut3 baak6 waa6
空心大老倌,hung1 sam1 daai6 lou5 gun1
空穴來風未必無因,hung1 jyut6 loi4 fung1 mei6 bit1 mou4 jan1
穿一條褲子,cyun1 jat1 tiu4 fu3 zi2
穿咗窿,cyun1 zo2 lung1
窒咗一下,zat6 zo2 jat1 haa5
窮到褲穿窿,kung4 dou3 fu3 cyun1 lung1
窮在鬧市無人問，富在深山有遠親,kung4 zoi6 naau6 si5 mou4 jan4 man6 fu3 zoi6 sam1 saan1 jau5 jyun5 can1
窿窿啦啦,lung1 lung1 la1 la1
竊鉤者誅，竊國者侯,sit3 ngau1 ze2 zyu1 sit3 gwok3 ze2 hau4
立於不敗之地,laap6 jyu1 bat1 baai6 zi1 dei6
站着說話不腰疼,zaam6 zoek6 syut3 waa6 bat1 jiu1 tung3
童子軍跳彈牀,tung4 zi2 gwan1 tiu3 daan6 cong4
童子軍跳彈牀是但,tung4 zi2 gwan1 tiu3 daan6 cong4 si6 daan6
竹筒倒豆子,zuk1 tung2 dou2 dau2 zi2
竹籃打水，一場空,zuk1 laam4 daa2 seoi2 jat1 coeng4 hung1
竹門對竹門，木門對木門,zuk1 mun4 deoi3 zuk1 mun4 muk6 mun4 deoi3 muk6 mun4
笑到㗎㗎聲,siu3 dou3 gaak1 gaak1 seng1
笑到畸畸聲,siu3 dou3 ki1 ki1 seng1
笑到肚都攣,siu3 dou3 tou5 dou1 lyun1
笑到腸都攣,siu3 dou3 coeng2 dou1 lyun1
笑到見牙唔見眼,siu3 dou3 gin3 ngaa4 m4 gin3 ngaan5
笑大人個口,siu3 daai6 jan4 go3 hau2
笑左，笑埋右,siu3 zo2 siu3 maai4 jau6
笑撚咗,siu3 lan2 zo2
笑笑口噉講,siu3 siu3 hau2 gam2 gong2
笑貧不笑娼,siu3 pan4 bat1 siu3 coeng1
笠亂食嘢,laap6 lyun2 sik6 je5
第二啲,dai6 ji6 di1
第樣嘢,dai6 joeng6 je5
筆勝於刀文比武強,bat1 sing3 jyu1 dou1 man4 bei2 mou5 koeng4
等佢覆,dang2 keoi5 fuk1
等到頸都長,dang2 dou3 geng2 dou1 coeng4
等埋我,dang2 maai4 ngo5
等我一陣,dang2 ngo5 jat1 zan6
等我去吖,dang2 ngo5 heoi3 aa1
等我嚟,dang2 ngo5 lai4
等我着衫,dang2 ngo5 zoek3 saam1
等我睇下,dang2 ngo5 tai2 haa5
等極唔見,dang2 gik6 m4 gin3
等等啦,dang2 dang2 la1
等緊你啊,dang2 gan2 nei5 aa3
等陣搵你,dang2 zan6 wan2 nei5
答唔切,daap3 m4 cit3
箍唔過,ku1 m4 gwo3
算乜嘢,syun3 mat1 je5
